job_id,company,role,description,has_ai_keywords,is_remote,location,salary,salary_min,salary_max,requires_python,requires_js,created_date,redirect_url,category,contract_type,text_length,source,scraped_date
5462917544,Murgado Automotive Group,Receptionist,"Job Description Job Description Join Our Team! Honda of Libertyville, part of the esteemed Murgado Automotive Group, is seeking a friendly, organized, and customer-focused Receptionist to be the first point of contact for our clients. If you are passionate about delivering exceptional service and enjoy working in a fast-paced environment, we want to hear from you! Position Summary: As the Receptionist, you will play a crucial role in creating a welcoming experience for our customers, ensuring a…",False,False,"Libertyville, Lake County",$25k-$25k,25142.61,25142.61,False,False,2025-10-24T12:51:06Z,https://www.adzuna.com/details/5462917544?utm_medium=api&utm_source=4ad8a509,Customer Services Jobs,,500,adzuna,2025-10-24
5462917562,TSMG,"Driver / Data Collector in Houston, TX","Job Description Job Description Company description Service Measure (SM) is a field data collection company founded in 2013 in New York. We collect data where automation is not possible. We count features, take pictures, make videos, record speech, and scan areas for every detail you need to make more informed decisions. Our field data collection teams are spread across Europe and North America, ready to accept new challenges. Project objective The goal of the project is to help collect images …",False,False,"Houston, Harris County",$55k-$55k,54690.0,54690.0,False,False,2025-10-24T12:51:06Z,https://www.adzuna.com/details/5462917562?utm_medium=api&utm_source=4ad8a509,Scientific & QA Jobs,,500,adzuna,2025-10-24
5462917564,Monster Tree Service,Tree Climber/Arborist - Monster Tree Service of the Research Triangle,"Job Description Job Description So, what sets Monster Tree Service apart from other employers? Extensive experience. State-of-the-art equipment. True love and commitment to the environment. superb customer service, a rapidly growing footprint, dynamic work ethic, a unique philosophy, and most important…the Monster Team! Each Monster Tree Service is an individually owned and operated franchise. If you are looking to be part of a team that is growing and changing the Tree Care Industry in a posit…",False,False,"Cary, Wake County",$65k-$65k,64707.59,64707.59,False,False,2025-10-24T12:51:06Z,https://www.adzuna.com/details/5462917564?utm_medium=api&utm_source=4ad8a509,Trade & Construction Jobs,,500,adzuna,2025-10-24
5462917565,Walker Consultants,Project Manager,"Job Description Job Description Location: Denver, CO or Phoenix, AZ Employment Type: Full-time regular How Your Role will Shape Our Success In this mid-level role, you will be the face and brain of projects and lead the team of Engineers and Architects to success. This position reports to the local Director of Design Services and then up to the Managing Principal of the office. This position offers excellent career advancement opportunities throughout the organization. What Sets Us Apart? Walke…",False,False,"Denver, Colorado",$95k-$95k,94714.73,94714.73,False,False,2025-10-24T12:51:06Z,https://www.adzuna.com/details/5462917565?utm_medium=api&utm_source=4ad8a509,Engineering Jobs,,500,adzuna,2025-10-24
5462917555,Farfetch,Store Manager,"Job Description Job Description Off-White is a new form of luxury brand. Construction and deconstruction go hand in hand, recombining the codes of fashion, design, communication, art and technology. Well thought, well designed and well executed products are aesthetic as well as ethical statements with a contemporary cultural edge. Progress, innovation and diversity. We have taken the notion and development of a fashion brand to a new level altogether. Based in Milan, our creative office absorbs…",False,False,"Woodbury, Gloucester County",$77k-$77k,77316.59,77316.59,False,False,2025-10-24T12:51:06Z,https://www.adzuna.com/details/5462917555?utm_medium=api&utm_source=4ad8a509,Retail Jobs,,500,adzuna,2025-10-24
5462917559,GoPuff,"Operations Associate, Milwaukee, 136","Job Description Job Description Gopuff is looking for Operations Associates (OAs) to join the operations team. Directly reporting to a Site Leader, OAs play an essential role at Gopuff that requires drive, perseverance, positivity, and enthusiasm for the challenge. You will accomplish a variety of operations responsibilities including picking, packing, receiving product both within our site and accompanying kitchen (if applicable), and working with our partner drivers. Customers turn to Gopuff …",False,False,"Milwaukee, Milwaukee County",$34k-$34k,34242.84,34242.84,False,False,2025-10-24T12:51:06Z,https://www.adzuna.com/details/5462917559?utm_medium=api&utm_source=4ad8a509,Hospitality & Catering Jobs,,500,adzuna,2025-10-24
5462917551,"Contact Government Services, LLC",Litigation Systems Analyst,"Job Description Job Description Litigation Systems Analyst Employment Type: Full Time, Mid-level Department: Litigation Support CGS is seeking a Systems Analyst to join our team supporting a wide-ranging technical support initiative for a large Federal agency’s ongoing litigation efforts. CGS brings motivated, highly skilled, and creative people together to solve the government’s most dynamic problems with cutting-edge technology. To carry out our mission, we are seeking candidates who are exci…",False,False,"Atlanta, Fulton County",$125k-$125k,125063.64,125063.64,False,False,2025-10-24T12:51:06Z,https://www.adzuna.com/details/5462917551?utm_medium=api&utm_source=4ad8a509,IT Jobs,,500,adzuna,2025-10-24
5462917401,"Contact Government Services, LLC",eDiscovery Program Manager (Top Secret Clearance Required),"Job Description Job Description eDiscovery Program Manager Employment Type: Full-Time, Executive-Level Department: Legal CGS is seeking a dedicated eDiscovery Program Manager to join a fast-paced and hard-working team to assist with any legal accounts. As an eDiscovery Program Manager, you will play a key role in supporting various aspects of the company's portfolio. CGS brings motivated, highly skilled, and creative people together to solve the government’s most dynamic problems with cutting-e…",False,False,"Washington, Washington, D.C.",$150k-$150k,150490.84,150490.84,False,False,2025-10-24T12:51:04Z,https://www.adzuna.com/details/5462917401?utm_medium=api&utm_source=4ad8a509,IT Jobs,,500,adzuna,2025-10-24
5462917406,"Contact Government Services, LLC",Senior Oracle APEX Developer II,"Job Description Job Description Senior Oracle APEX Developer II Employment Type: Full-Time, Entry-Mid Level Department: Information Technology CGS is hiring a Senior Oracle APEX Developer to support a range of IT services, including software application support, enterprise infrastructure support, service desk, ITSM, deskside support, workstation engineering and maintenance, telecommunications and mobility engineering services, managed print services, Active Directory services, and video confere…",False,False,"Los Angeles, Los Angeles County",$165k-$165k,165476.48,165476.48,False,False,2025-10-24T12:51:04Z,https://www.adzuna.com/details/5462917406?utm_medium=api&utm_source=4ad8a509,IT Jobs,,500,adzuna,2025-10-24
5462917402,Highwire,"Public Relations Account Executive, B2B Tech & Professional Services","Job Description Job Description About us Highwire is a modern strategic communications and digital marketing agency designed for disruptive companies. We work with high-growth technology companies and established brands looking to reinvent themselves. At Highwire, we believe that storytelling fuels transformation. And the most impactful stories represent all voices and perspectives. As a values-driven agency, we foster an inclusive environment where everyone—regardless of age, race/ethnicity, s…",False,False,"Miami, Miami-Dade County",$150k-$150k,149759.53,149759.53,False,False,2025-10-24T12:51:04Z,https://www.adzuna.com/details/5462917402?utm_medium=api&utm_source=4ad8a509,"PR, Advertising & Marketing Jobs",,500,adzuna,2025-10-24
5462917425,Sila Services,Apprentice/Helper,"Job Description Job Description What We Do We are a team of home service experts who go the extra mile to ensure peak performance for your home’s plumbing, heating and air conditioning and electrical systems. Do you have strong organizational, customer service, and problem-solving skills? Do you like working in a fast-paced environment and meeting the changing needs of the home service business and its customers? Then we want to talk to you. The HVAC Apprentice/Driver will learn from and work i…",False,False,"Norwalk, Fairfield County",$41k-$41k,41407.25,41407.25,False,False,2025-10-24T12:51:04Z,https://www.adzuna.com/land/ad/5462917425?se=vCNyyv6w8BGrA4crpEIj3A&utm_medium=api&utm_source=4ad8a509&v=7766CAFC7EFE1650CDE8B4E0098E23CB28B03149,Trade & Construction Jobs,,500,adzuna,2025-10-24
5462917415,BDG,Data Engineer,"Job Description Job Description Bustle Digital Group (BDG) is looking for a talented Data Engineer to join our growing data team. You will work alongside the Director of Data Engineering to build, optimize, and scale our data infrastructure, supporting the development of data-driven products and insights that power our advertising, affiliate sales, and editorial content strategies. This is a fantastic opportunity to work with large-scale data pipelines, cutting-edge technologies, and a dynamic …",False,False,"New York City, New York",$136k-$136k,135658.75,135658.75,False,False,2025-10-24T12:51:04Z,https://www.adzuna.com/details/5462917415?utm_medium=api&utm_source=4ad8a509,IT Jobs,,500,adzuna,2025-10-24
5462917391,Zūm,"Senior Engineer, Back Platform","Job Description Job Description About Zum: Zum is a rapidly expanding Series E startup backed by industry leaders Sequoia Capital, SoftBank, Spark Capital, and GIC, with a bold mission to transform the stagnant school transportation industry. Operating in over 15 states across the United States—with flagship hubs in San Francisco, Los Angeles, and Seattle—we are actively extending our reach to the East Coast and Midwest regions. As a technology-driven company, we deploy cutting-edge solutions t…",False,False,"Redwood City, San Mateo County",$186k-$186k,185554.08,185554.08,False,False,2025-10-24T12:51:03Z,https://www.adzuna.com/details/5462917391?utm_medium=api&utm_source=4ad8a509,Engineering Jobs,,500,adzuna,2025-10-24
5462917392,BPM LLP,Bookkeeping Manager - Tax Department,"Job Description Job Description BPM Overview What does BPM stand for? Innovation, opportunity, community, diversity, inclusivity, flexibility, and so much more. B-P-M stands for “Because People Matter,” because at our core, our people drive everything we do and how we do it. We are a forward-thinking, full-service accounting firm providing modern solutions to businesses across the globe. We focus on comprehensive assurance, tax, and consulting services for our clients, and we provide our people…",False,False,"Las Vegas, Clark County",$141k-$141k,140706.86,140706.86,False,False,2025-10-24T12:51:03Z,https://www.adzuna.com/details/5462917392?utm_medium=api&utm_source=4ad8a509,Accounting & Finance Jobs,,500,adzuna,2025-10-24
5462917303,"Link, LLC","SDR, RF Systems Engineer, BS6 or HS10","Job Description Job Description (U)Systems Engineer with experience interfacing wideband digitizing receivers and software defined radio systems to processing software running on standard general-purpose hardware. Familiarity with the following are highly desirable: VITA-49, low-level drivers software, RHEL, multi-Gigabit Ethernet over copper and fiber optics, RF sources, amplifiers, filters, dividers, etc. (U)Successful candidate will evaluate new hardware from multiple vendors and work with t…",False,False,"Fort George G Meade, Anne Arundel County",$87k-$87k,86900.95,86900.95,False,False,2025-10-24T12:51:02Z,https://www.adzuna.com/details/5462917303?utm_medium=api&utm_source=4ad8a509,IT Jobs,,500,adzuna,2025-10-24
5462917295,Foth,Project Civil Engineer,"Job Description Job Description Foth is a 100% member-owned science and engineering consulting firm headquartered in Wisconsin, with over 85 years of success. Our 700 members across 30 locations are dedicated to solving our clients’ toughest science and engineering challenges . Consistently ranked by Engineering News Record in the top 150 firms, we offer a values-based, collaborative, and flexible work environment with professional growth opportunities. If you thrive working alongside a smart, …",False,False,"Green Bay, Brown County",$79k-$79k,79449.36,79449.36,False,False,2025-10-24T12:51:02Z,https://www.adzuna.com/details/5462917295?utm_medium=api&utm_source=4ad8a509,Engineering Jobs,,500,adzuna,2025-10-24
5462917299,"Contact Government Services, LLC",ServiceNow Developer,"Job Description Job Description ServiceNow Developer Employment Type: Full-Time, Mid-level Department: Information Technology CGS is seeking a ServiceNow Developer to join our team supporting a wide-ranging technical support initiative for a large Federal agency. CGS brings motivated, highly skilled, and creative people together to solve the government’s most dynamic problems with cutting-edge technology. To carry out our mission, we are seeking candidates who are excited to contribute to gover…",False,False,"Atlanta, Fulton County",$110k-$110k,110344.7,110344.7,False,False,2025-10-24T12:51:02Z,https://www.adzuna.com/details/5462917299?utm_medium=api&utm_source=4ad8a509,IT Jobs,,500,adzuna,2025-10-24
5462917302,Western Aircraft,Avionics Internship - SkillBridge,"Job Description Job Description JOB SUMMARY THIS OPPORTUNITY IS FOR TRANSITIONING SERVICE MEMBERS ONLY Western Aircraft is an approved SkillBridge Internship provider under the Department of Defense Instruction 1322.29. Our Aircraft Maintenance Internship is an excellent opportunity for transitioning service members to gain valuable civilian work experience during their last 180 days of active-duty service. SkillBridge participants are not eligible for compensation from Western Aircraft, as the…",False,False,"Idaho City, Boise County",$50k-$50k,50046.28,50046.28,False,False,2025-10-24T12:51:02Z,https://www.adzuna.com/details/5462917302?utm_medium=api&utm_source=4ad8a509,Engineering Jobs,,500,adzuna,2025-10-24
5462917306,CFGI,Manager,"Job Description Job Description Manager – Accounting Advisory Managers at CFGI work closely with senior management of Fortune 500, mid-cap, and start-up companies. CFGI Managers lead project teams and interact with clients and their Big 4 auditors on all aspects of engagements, including report writing, developing and managing client relationships, and business development. Take ownership of your career at CFGI: · Gain exposure to a wide range of industries and/or projects. · Make a true busine…",False,False,"Los Angeles, Los Angeles County",$151k-$151k,150584.73,150584.73,False,False,2025-10-24T12:51:02Z,https://www.adzuna.com/details/5462917306?utm_medium=api&utm_source=4ad8a509,Accounting & Finance Jobs,,500,adzuna,2025-10-24
5462917296,Buck Mason,Store Manager (Northpark),"Job Description Job Description Join the Buck Mason Team as a Store Manager! Are you ready to be the heartbeat of Buck Mason, living and breathing our culture, customer experience, and lifestyle? As the leader of your shop, you’ll be the driving force behind our sales, customer service, recruiting, educating staff, managing payroll, overseeing inventory, maintaining store standards, and team development. We're looking for someone with 3-5 years of leadership experience in a specialty retail env…",False,False,"Dallas, Texas",$69k-$69k,68923.0,68923.0,False,False,2025-10-24T12:51:02Z,https://www.adzuna.com/details/5462917296?utm_medium=api&utm_source=4ad8a509,Retail Jobs,,500,adzuna,2025-10-24
5462917292,Lightedge,ServiceNow Developer,"Job Description Job Description LightEdge is seeking a skilled ServiceNow Developer to join our team and help us enhance and customize our ServiceNow platform. As a ServiceNow Developer, you will be responsible for designing and implementing custom solutions within the ServiceNow ecosystem to meet the needs of our organization. If you are a motivated ServiceNow Developer who is passionate about delivering high-quality solutions and enjoys working in a collaborative team environment, we encourag…",False,False,"Des Moines, Polk County",$96k-$96k,96264.92,96264.92,False,False,2025-10-24T12:51:02Z,https://www.adzuna.com/details/5462917292?utm_medium=api&utm_source=4ad8a509,IT Jobs,,500,adzuna,2025-10-24
5462917239,Boston Red Sox and Fenway Sports Management,Senior Baseball Sciences Developer,"Job Description Job Description DEPARTMENT OVERVIEW: Members of the Baseball Systems team at the Boston Red Sox are focused on designing, building, and refining the software and data pipelines used within Baseball Operations. These tools and applications are an integral part of the decision-making process, are directly integrated in the workflows of all departments within Baseball Operations, and provide an efficient, consistent, and accessible experience when interacting with our internal data…",False,False,"Boston, Suffolk County",$65k-$65k,64692.36,64692.36,False,False,2025-10-24T12:51:01Z,https://www.adzuna.com/details/5462917239?utm_medium=api&utm_source=4ad8a509,IT Jobs,,500,adzuna,2025-10-24
5462917249,Cloudforce,Project Manager,"Job Description Job Description Job Title: Project Manager Location: National Harbor, MD (Hybrid) Type: Full Time Compensation: $65,000 to $100,000 DOE, Annually  Bonus Opportunities Please note - applicants must be authorized to work for any employer in the U.S. We are unable to sponsor or take over sponsorship of an employment visa at this time. Eager to work at the intersection of business and bleeding-edge technology? Join a team that’s all in on bringing next-generation AI and cloud capabi…",False,False,"National Harbor, Prince George's County",$95k-$95k,94777.53,94777.53,False,False,2025-10-24T12:51:01Z,https://www.adzuna.com/details/5462917249?utm_medium=api&utm_source=4ad8a509,IT Jobs,,500,adzuna,2025-10-24
5462917258,TSMG,Autonomous vehicle Operator with CDL,"Job Description Job Description Company description Terry Soot Management Group (TSMG) is a field data collection company founded in 2017 in Europe. We collect data where automation is not possible. We count features, take pictures, make videos, record speech, and scan areas for every detail you need to make more informed decisions. Our field data collection teams are spread across Europe and North America, ready to accept new challenges. Role Overview: The Autonomous Vehicle Test Operator is r…",False,False,"Miami, Miami-Dade County",$88k-$88k,87834.72,87834.72,False,False,2025-10-24T12:51:01Z,https://www.adzuna.com/details/5462917258?utm_medium=api&utm_source=4ad8a509,Logistics & Warehouse Jobs,,500,adzuna,2025-10-24
5462917246,"Contact Government Services, LLC",Business Analyst,"Job Description Job Description Business Analyst Employment Type: Full-Time, Experienced Department: Information Technology CGS is looking for business analysts to work with a large federal agency! As a Business Analyst in Business operations and Content Strategy for CGS, you will partner with internal business owners and external partners to understand new business opportunities and define functional requirements. CGS brings motivated, highly skilled, and creative people together to solve the …",False,False,"Rockville, Montgomery County",$117k-$117k,117139.59,117139.59,False,False,2025-10-24T12:51:01Z,https://www.adzuna.com/details/5462917246?utm_medium=api&utm_source=4ad8a509,IT Jobs,,500,adzuna,2025-10-24
5462917236,Equitas Academy Charter Schools,English Teacher - Middle School,"Job Description Job Description The mission of Equitas Academy Charter Schools is prepare students for college, careers, and life pursuits, and inspires them to be champions of equity. We currently serve over 2,000 students and operate six schools in the Pico-Union neighborhood of Los Angeles. What Equitas Can Offer You: A strong organizational culture, focused on our mission of preparing all scholars for college, careers, and life pursuits. A community that is committed to building and sustain…",False,False,"Los Angeles, Los Angeles County",$67k-$67k,67011.37,67011.37,False,False,2025-10-24T12:51:01Z,https://www.adzuna.com/details/5462917236?utm_medium=api&utm_source=4ad8a509,Teaching Jobs,,500,adzuna,2025-10-24
5462917244,E2 Optics,Data Center Infrastructure Technician,"Job Description Job Description Join our team and shape the future of connectivity: Data Center Infrastructure Technician at E2 Optics! CLICK HERE to learn more! Are you ready to advance your career with an award-winning, Woman-Owned technology integrator? E2 Optics is a fast-growing, stable company at the center of the booming data center industry—powering the infrastructure behind AI and the future of tech. Our team is shaping what’s next, with real impact and room to grow. We move fast, work…",False,False,"Idaho City, Boise County",$53k-$53k,53400.24,53400.24,False,False,2025-10-24T12:51:01Z,https://www.adzuna.com/details/5462917244?utm_medium=api&utm_source=4ad8a509,Engineering Jobs,,500,adzuna,2025-10-24
5462917242,Farnsworth,Talent Acquisition Specialist,"Job Description Job Description In this role, you will play a key part in driving talent acquisition strategies to attract top talent for our fast growing teams, while ensuring the company's HR policies and processes are effectively implemented and aligned with our growth objectives. We may use artificial intelligence (AI) tools to support parts of the hiring process, such as reviewing applications, analyzing resumes, or assessing responses. These tools assist our recruitment team but do not re…",True,False,"Bloomington, McLean County",$72k-$72k,72425.34,72425.34,False,False,2025-10-24T12:51:01Z,https://www.adzuna.com/details/5462917242?utm_medium=api&utm_source=4ad8a509,"PR, Advertising & Marketing Jobs",,500,adzuna,2025-10-24
5462917241,Prime Electric,Assistant Project Manager,"Job Description Job Description Who We Are At PRIME, a culture of empathy, trust, and belonging are foundational. This is integral in our approach to recruiting, developing, and retaining the best people in the industry. Our growth mindset drives us to embrace challenges and discover what sparks inspiration for creative solutions. PRIME is compelled to keep evolving, and creating new opportunities for those who perform. Our comprehensive services cover the entire lifecycle of a project, capabil…",False,False,"San Jose, Santa Clara County",$94k-$94k,94186.98,94186.98,False,False,2025-10-24T12:51:01Z,https://www.adzuna.com/details/5462917241?utm_medium=api&utm_source=4ad8a509,Consultancy Jobs,,500,adzuna,2025-10-24
5462917243,"Contact Government Services, LLC",Healthcare Fraud Investigator,"Job Description Job Description Healthcare Fraud Investigator Employment Type: Full-Time, Mid-Level Department: Litigation Support CGS is seeking a Healthcare Fraud Investigator to provide Legal Support for a large Government Project in Nashville, TN. The candidate must take the initiative to ask questions to successfully complete tasks, perform detailed work consistently, accurately, and under pressure, and be enthusiastic about learning and applying knowledge to provide excellent litigation s…",False,False,"Charlotte, Mecklenburg County",$80k-$80k,80146.66,80146.66,False,False,2025-10-24T12:51:01Z,https://www.adzuna.com/details/5462917243?utm_medium=api&utm_source=4ad8a509,Legal Jobs,,500,adzuna,2025-10-24
5462917107,Stanley Consultants,Traffic Section Manager,"Job Description Job Description Stanley Consultants is an award-winning and industry-leading global consulting engineering firm, with an unmatched commitment to culture, values, and ethics. We are dedicated to client experience and solve the most complex challenges to create a sustainable, connected, and enriched world for all. As the world changes, Stanley strategically evolves with it, integrating the latest technology, innovation, and resiliency practices. With over a century of experience s…",False,False,"Phoenix, Maricopa County",$123k-$123k,122910.02,122910.02,False,False,2025-10-24T12:50:59Z,https://www.adzuna.com/details/5462917107?utm_medium=api&utm_source=4ad8a509,Engineering Jobs,,500,adzuna,2025-10-24
5462917118,GoPuff,"Operations Associate, Phoenix, 299","Job Description Job Description Gopuff is looking for Operations Associates (OAs) to join the operations team. Directly reporting to a Site Leader, OAs play an essential role at Gopuff that requires drive, perseverance, positivity, and enthusiasm for the challenge. You will accomplish a variety of operations responsibilities including picking, packing, receiving product both within our site and accompanying kitchen (if applicable), and working with our partner drivers. Customers turn to Gopuff …",False,False,"Phoenix, Maricopa County",$37k-$37k,36574.12,36574.12,False,False,2025-10-24T12:50:59Z,https://www.adzuna.com/details/5462917118?utm_medium=api&utm_source=4ad8a509,Hospitality & Catering Jobs,,500,adzuna,2025-10-24
