job_id,company,role,description,has_ai_keywords,is_remote,location,salary,salary_min,salary_max,requires_python,requires_js,created_date,redirect_url,category,contract_type,text_length,source,scraped_date
5462939884,Intermountain Health,Director Nursing Peri-Op Services,"Job Description: The Nursing Director provides leadership and operational direction to Peri-op / Surgical Services at Lutheran Hospital and partners with the hospital Chief Nursing Officer and other management to ensure optimal patient care, financial goals, and leadership development. Along with offering a chance to work in a stable, strong, mission-based environment, this role provides the opportunity to experience the Mountain West’s diverse culture and incredible landscapes. You’ll be able …",False,False,"Wheat Ridge, Jefferson County",$159k-$159k,159000.34,159000.34,False,False,2025-10-24T13:06:10Z,https://www.adzuna.com/details/5462939884?utm_medium=api&utm_source=4ad8a509,Healthcare & Nursing Jobs,,500,adzuna,2025-10-24
5462939875,Intermountain Health,Angio Interventionalist,"Job Description: Responsible for completing Angiography procedures, scrubbing, setting techniques, and taking images. If you are interested in learning more about this role or about Intermountain Health, click here to schedule time with me! Posting Specifics Shift Details : Part-time (30 hours), Variable, three 10's. Call, Holiday Coverage Unit/Location: Saint Joseph Hospital Additional Details: Please review Minimum Qualifications listed below before applying. Are you interested in advancing y…",False,False,"Glendale, Denver",$100k-$100k,100424.88,100424.88,False,False,2025-10-24T13:06:10Z,https://www.adzuna.com/details/5462939875?utm_medium=api&utm_source=4ad8a509,Healthcare & Nursing Jobs,,500,adzuna,2025-10-24
5462939778,Intermountain Health,Radiology Technologist,"Job Description: Radiology Technologists at Intermountain Health are committed to providing patient centered care while demonstrating our values of Integrity, Trust, Excellence, Accountability, and Mutual Respect. If you are interested in contributing to our mission of helping people live the healthiest lives possible- come join our team! What does it mean to be a caregiver with Intermountain? Check out this video and learn more and discover the “Power of We.” To learn more about this exciting …",False,False,"Brighton, Adams County",$81k-$81k,81108.2,81108.2,False,False,2025-10-24T13:06:08Z,https://www.adzuna.com/details/5462939778?utm_medium=api&utm_source=4ad8a509,Healthcare & Nursing Jobs,,500,adzuna,2025-10-24
5462939615,Intermountain Health,MRI Technologist,"Job Description: MRI Technologists at Intermountain Health are committed to providing patient centered care while demonstrating our values of Integrity, Trust, Excellence, Accountability, and Mutual Respect. If you are interested in contributing to our mission of helping people live the healthiest lives possible- come join our team! What does it mean to be a caregiver with Intermountain? Check out this video and learn more and discover the “Power of We.” To learn more about this exciting opport…",False,False,"Wheat Ridge, Jefferson County",$99k-$99k,98970.95,98970.95,False,False,2025-10-24T13:06:04Z,https://www.adzuna.com/details/5462939615?utm_medium=api&utm_source=4ad8a509,Healthcare & Nursing Jobs,,500,adzuna,2025-10-24
5462939584,Intermountain Health,Radiology Technologist Travel Team,"Job Description: Radiology Technologists at Intermountain Health are committed to providing patient centered care while demonstrating our values of Integrity, Trust, Excellence, Accountability, and Mutual Respect. If you are interested in contributing to our mission of helping people live the healthiest lives possible- come join our team! What does it mean to be a caregiver with Intermountain? Check out this video and learn more and discover the “Power of We.” To learn more about this exciting …",False,False,"Lafayette, Boulder County",$91k-$91k,90819.11,90819.11,False,False,2025-10-24T13:06:03Z,https://www.adzuna.com/details/5462939584?utm_medium=api&utm_source=4ad8a509,Healthcare & Nursing Jobs,,500,adzuna,2025-10-24
5462939609,Intermountain Health,"Cardiovascular Technologist EP $15,000 Sign On Bonus",Job Description: The CV Invasive Specialist performs duties necessary for cardiac catheterization procedures at a technical and professional level requiring some proctoring and supervision of technical detail. The Specialist performs a variety of technical procedures that require some independent judgment. The CV Invasive Specialist assumes responsibility and initiative for designated areas and procedures as required. To show our commitment to you and assist with your transition into our organi…,False,False,"Glendale, Denver",$65k-$65k,65262.07,65262.07,False,False,2025-10-24T13:06:03Z,https://www.adzuna.com/details/5462939609?utm_medium=api&utm_source=4ad8a509,Healthcare & Nursing Jobs,,500,adzuna,2025-10-24
5462939531,Intermountain Health,Registered Nurse Telemetry,"Job Description: The Registered Nurse (RN) is a professional caregiver who assumes responsibility and accountability for assessing, planning, implementing, and evaluating the care of patients. The staff RN utilizes the nursing process by use of technology, therapeutic intervention, evidence-based practice and coordination of care with other health team members. Essential Functions Shift- Night Shift Assess: Performs appropriate assessment of physical, social, and psychological status (including…",False,False,"Lafayette, Boulder County",$124k-$124k,123920.68,123920.68,False,False,2025-10-24T13:06:02Z,https://www.adzuna.com/details/5462939531?utm_medium=api&utm_source=4ad8a509,Healthcare & Nursing Jobs,,500,adzuna,2025-10-24
5462936922,Heart and Vascular - Denver - Intermountain Health,Cardio-Thoracic Surgery - Physician,"Cardio-Thoracic Surgery - Physician at Heart and Vascular - Denver - Intermountain Health summary: A Cardiothoracic Surgeon at Intermountain Health provides advanced surgical care for heart and vascular conditions, collaborating within a multidisciplinary team to deliver high-quality patient outcomes. This role involves performing complex procedures such as coronary artery bypass grafting, valve replacements, and structural heart interventions at a top-tier hospital recognized for excellence in…",False,False,"Glendale, Denver",$135k-$135k,135192.25,135192.25,False,False,2025-10-24T13:03:50Z,https://www.adzuna.com/details/5462936922?utm_medium=api&utm_source=4ad8a509,Healthcare & Nursing Jobs,,500,adzuna,2025-10-24
5462935258,Intermountain Health,CT Technologist Travel Team,"Job Description: CT/X-ray Technologists at Intermountain Health are committed to providing patient centered care while demonstrating our values of Integrity, Trust, Excellence, Accountability, and Mutual Respect. If you are interested in contributing to our mission of helping people live the healthiest lives possible- come join our team! What does it mean to be a caregiver with Intermountain? Check out this video and learn more and discover the “Power of We.” To learn more about this exciting o…",False,False,"Glendale, Denver",$98k-$98k,97879.39,97879.39,False,False,2025-10-24T13:03:12Z,https://www.adzuna.com/details/5462935258?utm_medium=api&utm_source=4ad8a509,Healthcare & Nursing Jobs,,500,adzuna,2025-10-24
5462935075,Intermountain Health,MRI Technologist,"Job Description: Join Our Team as an MRI Technologist! We are seeking a dedicated and skilled MRI Technologist to join our healthcare team. If you're passionate about providing exceptional care and want to work in an environment that values growth, we’d love to hear from you! Discover why Intermountain Health is a great place to work (youtube.com) Posting Specifics Entry Rate: $38.77 depending on experience Benefits Eligible: No Shift Details: PRN, no guaranteed hours Minimum Qualifications Ame…",False,False,"Boise, Ada County",$123k-$123k,122911.66,122911.66,False,False,2025-10-24T13:03:11Z,https://www.adzuna.com/details/5462935075?utm_medium=api&utm_source=4ad8a509,Healthcare & Nursing Jobs,,500,adzuna,2025-10-24
5462935120,Intermountain Health,MRI Technologist,"Job Description: As an MRI Technologist, you will be responsible for performing diagnostic MRI exams on patients using specialized equipment. You will work closely with radiologists, physicians, and other healthcare professionals to ensure accurate and high-quality imaging results. The ideal candidate will have a strong understanding of imaging techniques, excellent patient care skills, and the ability to work in a fast-paced environment. Essential Functions Maintains American Registry of Radio…",False,False,"North Logan, Cache County",$87k-$87k,87214.29,87214.29,False,False,2025-10-24T13:03:11Z,https://www.adzuna.com/details/5462935120?utm_medium=api&utm_source=4ad8a509,Healthcare & Nursing Jobs,,500,adzuna,2025-10-24
5462935112,Intermountain Health,Mammography Technologist,"Job Description: The Mammography Technologist performs radiographic mammography procedures which produce high quality diagnostic films for use in the detection of breast tissue abnormalities. This position works on a level not requiring constant supervision and performs a variety of procedures that require independent judgment, creativity, and initiative. If you are interested in learning more about this role or about Intermountain Health, click here to schedule time with me! Posting Specifics …",False,False,"Wheat Ridge, Jefferson County",$90k-$90k,89992.2,89992.2,False,False,2025-10-24T13:03:11Z,https://www.adzuna.com/details/5462935112?utm_medium=api&utm_source=4ad8a509,Healthcare & Nursing Jobs,,500,adzuna,2025-10-24
5462935056,Lockheed Martin,Modernization Software Engineer - SWE3,"Job ID: 693717BR Date posted: Sep. 26, 2025 Description: Who You Are: Here, you are going to provide life-cycle services to advance mission in support of Cybersecurity and SIGINT midpoint collection. • You will modernize and sustain capabilities to include providing new features and enhancements to Front End Solutions systems. This will allow for products to work at-scale with processing of target communications across multiple types of Midpoint accesses. • You will propel the customer into the…",False,False,"Hanover, Anne Arundel County",$122k-$122k,122223.18,122223.18,False,False,2025-10-24T13:03:10Z,https://www.adzuna.com/details/5462935056?utm_medium=api&utm_source=4ad8a509,IT Jobs,,500,adzuna,2025-10-24
5462934950,Intermountain Health,Limited Scope Radiographer,"Job Description: Performs imaging exams for which the employee meets the Core Exam Specifications and as allowed by their Limited Scope Radiographer license. Employee must demonstrate competency in these areas through successful completion of skills test/competency review. Essential Functions Ensures proper patient identification, order verification, and prepares the patient for the exam. Is sensitive to the patients' needs throughout the procedure. Sufficiently explains to the patient and fami…",False,False,"Lafayette, Boulder County",$69k-$69k,69473.44,69473.44,False,False,2025-10-24T13:03:09Z,https://www.adzuna.com/details/5462934950?utm_medium=api&utm_source=4ad8a509,Healthcare & Nursing Jobs,,500,adzuna,2025-10-24
5462934954,Intermountain Health,MRI Technologist Float,"Job Description: MRI Technologists at Intermountain Health are committed to providing patient centered care while demonstrating our values of Integrity, Trust, Excellence, Accountability, and Mutual Respect. If you are interested in contributing to our mission of helping people live the healthiest lives possible- come join our team! What does it mean to be a caregiver with Intermountain? Check out this video and learn more and discover the “Power of We.” To learn more about this exciting opport…",False,False,"Glendale, Denver",$122k-$122k,122271.68,122271.68,False,False,2025-10-24T13:03:09Z,https://www.adzuna.com/details/5462934954?utm_medium=api&utm_source=4ad8a509,Healthcare & Nursing Jobs,,500,adzuna,2025-10-24
5462934807,Intermountain Health,CT Technologist,"Job Description: The CT Tech performs a variety of CT procedures using ionizing radiation for diagnostic purposes. This position uses ingenuity, iniative, and independent judgement to perform high quality scans. If you are interested in learning more about this role or about Intermountain Health, click here to schedule time with me! Posting Specifics Shift Details : Full-time (36 Hours), Tuesday & Wednesday 1pm-1:30am, Thursday 7pm-7:30am Unit/Location: Platte Valley Hospital Additional Details…",False,False,"Brighton, Adams County",$108k-$108k,107552.6,107552.6,False,False,2025-10-24T13:03:05Z,https://www.adzuna.com/details/5462934807?utm_medium=api&utm_source=4ad8a509,Healthcare & Nursing Jobs,,500,adzuna,2025-10-24
5462934800,Intermountain Health,Radiology Technologist,"Job Description: The Registered Radiology Technologist performs medical imaging examinations under the direction of a physician. Job Description If you are interested in learning more about this role or about Intermountain Health, click here to schedule time with me! Posting Specifics Shift Details : Full-time (40 hours), Tuesday-Friday, 8:30a-7p Unit/Location: St. Vincent Regional Hospital Additional Details: Please review Minimum Qualifications listed below before applying. Are you interested…",False,False,"Lockwood, Yellowstone County",$105k-$105k,105036.5,105036.5,False,False,2025-10-24T13:03:05Z,https://www.adzuna.com/details/5462934800?utm_medium=api&utm_source=4ad8a509,Healthcare & Nursing Jobs,,500,adzuna,2025-10-24
5462934767,Intermountain Health,Radiology Technologist,"Job Description: Radiology Technologists at Intermountain Health are committed to providing patient centered care while demonstrating our values of Integrity, Trust, Excellence, Accountability, and Mutual Respect. If you are interested in contributing to our mission of helping people live the healthiest lives possible- come join our team! What does it mean to be a caregiver with Intermountain? Check out this video and learn more and discover the “Power of We.” To learn more about this exciting …",False,False,"Aurora, Arapahoe County",$91k-$91k,91402.75,91402.75,False,False,2025-10-24T13:03:04Z,https://www.adzuna.com/details/5462934767?utm_medium=api&utm_source=4ad8a509,Healthcare & Nursing Jobs,,500,adzuna,2025-10-24
5462929136,Intermountain Health,Maternal Fetal Medicine Sonographer,"Job Description: The Maternal Fetal Medicine Sonographer performs diagnostic sonogram scans on patients using specialized equipment. The position works closely with radiologists, physicians, and other healthcare professionals to ensure accurate and high-quality imaging results while providing high-quality patient care, demonstrating a strong understanding of ultrasound imaging techniques and technical skill, and the ability to work effectively in a fast-paced environment. If you are interested …",False,False,"Wheat Ridge, Jefferson County",$161k-$161k,161415.55,161415.55,False,False,2025-10-24T12:57:06Z,https://www.adzuna.com/details/5462929136?utm_medium=api&utm_source=4ad8a509,Healthcare & Nursing Jobs,,500,adzuna,2025-10-24
5462929135,Intermountain Health,Radiology Technologist,"Job Description: Radiology Technologists at Intermountain Health are committed to providing patient centered care while demonstrating our values of Integrity, Trust, Excellence, Accountability, and Mutual Respect. If you are interested in contributing to our mission of helping people live the healthiest lives possible- come join our team! What does it mean to be a caregiver with Intermountain? Check out this video and learn more and discover the “Power of We.” To learn more about this exciting …",False,False,"Louviers, Douglas County",$84k-$84k,83767.48,83767.48,False,False,2025-10-24T12:57:06Z,https://www.adzuna.com/details/5462929135?utm_medium=api&utm_source=4ad8a509,Healthcare & Nursing Jobs,,500,adzuna,2025-10-24
5462929118,Intermountain Health,Registered Nurse Operating Room,"Job Description: The Registered Nurse (RN) is a professional caregiver who assumes responsibility and accountability for assessing, planning, implementing and evaluating care of patients. The staff RN utilizes the nursing process by use of technology, therapeutic intervention, evidence-based practice and coordination of care with other health team members. Job Description You. You bring your body, mind, heart and spirit to your work as an Operating Room Registered Nurse. You know how to stay or…",False,False,"Dakota Ridge, Jefferson County",$135k-$135k,135050.89,135050.89,False,False,2025-10-24T12:57:05Z,https://www.adzuna.com/details/5462929118?utm_medium=api&utm_source=4ad8a509,Healthcare & Nursing Jobs,,500,adzuna,2025-10-24
5462929038,Intermountain Health,IR Technologist,"Job Description: Angio/Interventionalist Technologist at Intermountain Health are committed to providing patient centered care while demonstrating our values of Integrity, Trust, Excellence, Accountability, and Mutual Respect. If you are interested in contributing to our mission of helping people live the healthiest lives possible- come join our team! What does it mean to be a caregiver with Intermountain? Check out this video and learn more and discover the “Power of We.” To learn more about t…",False,False,"Wheat Ridge, Jefferson County",$75k-$75k,74552.74,74552.74,False,False,2025-10-24T12:57:03Z,https://www.adzuna.com/details/5462929038?utm_medium=api&utm_source=4ad8a509,Healthcare & Nursing Jobs,,500,adzuna,2025-10-24
5462928862,Intermountain Health,Radiology Technologist Float,"Job Description: The Registered Radiology Technologist performs medical imaging examinations under the direction of a physician. What does it mean to be a caregiver with Intermountain? Check out this video and learn more and discover the “Power of We.” To learn more about this exciting opportunity, please Click Here to schedule a time to further discuss this opportunity. Posting Specifics Pay Range: $29.14 - $44.94 hourly (DOE) $10/hr float differential Benefits Eligible: Yes - Link to Benefit …",False,False,"Glendale, Denver",$95k-$95k,95112.73,95112.73,False,False,2025-10-24T12:57:00Z,https://www.adzuna.com/details/5462928862?utm_medium=api&utm_source=4ad8a509,Healthcare & Nursing Jobs,,500,adzuna,2025-10-24
5462925657,Intermountain Health,Radiology Technologist,"Job Description: Radiology Technologists at Intermountain Health are committed to providing patient centered care while demonstrating our values of Integrity, Trust, Excellence, Accountability, and Mutual Respect. If you are interested in contributing to our mission of helping people live the healthiest lives possible- come join our team! What does it mean to be a caregiver with Intermountain? Check out this video and learn more and discover the “Power of We.” To learn more about this exciting …",False,False,"Southglenn, Centennial",$96k-$96k,96391.97,96391.97,False,False,2025-10-24T12:53:39Z,https://www.adzuna.com/details/5462925657?utm_medium=api&utm_source=4ad8a509,Healthcare & Nursing Jobs,,500,adzuna,2025-10-24
5462925716,Intermountain Health,Radiology Technologist,"Job Description: The Registered Radiology Technologist performs medical imaging examinations under the direction of a physician. What does it mean to be a caregiver with Intermountain? Check out this video and learn more and discover the “Power of We.” To learn more about this exciting opportunity, please Click Here to schedule a time to further discuss this opportunity. Posting Specifics: Benefits Eligible: Yes - Link to Benefit Details Shift Details: Variable / We are accepting applications f…",False,False,"Wheat Ridge, Jefferson County",$74k-$74k,73748.29,73748.29,False,False,2025-10-24T12:53:39Z,https://www.adzuna.com/details/5462925716?utm_medium=api&utm_source=4ad8a509,Healthcare & Nursing Jobs,,500,adzuna,2025-10-24
5462925548,Intermountain Health,New Graduate Radiology Tech,"Job Description: Perform all diagnostic procedures within Scope of Practice under the direction of a Registered Radiology Technologist. Are you looking to start your career as a New Grad Radiology Tech with a company that will encourage you to grow while you help people live the healthiest lives possible? Posting Specifics Shift Details : Full-time (40 Hours), Monday – Friday Days, 8:00 to 5:00 Unit/Location: East Crossroads-Orthopedics and Podiatry As a Radiology Technologist at Intermountain …",False,False,"Brighton, Adams County",$127k-$127k,127002.34,127002.34,False,False,2025-10-24T12:53:38Z,https://www.adzuna.com/details/5462925548?utm_medium=api&utm_source=4ad8a509,Graduate Jobs,,500,adzuna,2025-10-24
5462925419,Intermountain Health,CT Technologist Float,"Job Description: CT Technologists at Intermountain Health are committed to providing patient centered care while demonstrating our values of Integrity, Trust, Excellence, Accountability, and Mutual Respect. If you are interested in contributing to our mission of helping people live the healthiest lives possible- come join our team! What does it mean to be a caregiver with Intermountain? Check out this video and learn more and discover the “Power of We.” To learn more about this exciting opportu…",False,False,"Glendale, Denver",$93k-$93k,93391.83,93391.83,False,False,2025-10-24T12:53:37Z,https://www.adzuna.com/details/5462925419?utm_medium=api&utm_source=4ad8a509,Healthcare & Nursing Jobs,,500,adzuna,2025-10-24
5462925428,Intermountain Health,Registered Nurse iFlex Internal Travel Team Multi Region,"Job Description: The Registered Nurse (RN) is a professional caregiver who assumes responsibility and accountability for assessing, planning, implementing and evaluating care of patients. The staff RN utilizes the nursing process by use of technology, therapeutic intervention, evidence-based practice and coordination of care with other health team members. Exciting Career Opportunity! Our iFlex Internal Travel Agency is hiring for a Registered Nurse role at St. Mary’s Regional Hospital in Grand…",False,False,"Lafayette, Boulder County",$81k-$81k,80774.88,80774.88,False,False,2025-10-24T12:53:37Z,https://www.adzuna.com/details/5462925428?utm_medium=api&utm_source=4ad8a509,Healthcare & Nursing Jobs,,500,adzuna,2025-10-24
5462925312,Intermountain Health,Radiology Technologist,"Job Description: Radiology Technologists at Intermountain Health are committed to providing patient centered care while demonstrating our values of Integrity, Trust, Excellence, Accountability, and Mutual Respect. If you are interested in contributing to our mission of helping people live the healthiest lives possible- come join our team! What does it mean to be a caregiver with Intermountain? Check out this video and learn more and discover the “Power of We.” To learn more about this exciting …",False,False,"Glendale, Denver",$90k-$90k,90213.38,90213.38,False,False,2025-10-24T12:53:36Z,https://www.adzuna.com/details/5462925312?utm_medium=api&utm_source=4ad8a509,Healthcare & Nursing Jobs,,500,adzuna,2025-10-24
5462925299,Intermountain Health,CT Technologist,"Job Description: CT Technologists at Intermountain Health are committed to providing patient centered care while demonstrating our values of Integrity, Trust, Excellence, Accountability, and Mutual Respect. If you are interested in contributing to our mission of helping people live the healthiest lives possible- come join our team! What does it mean to be a caregiver with Intermountain? Check out this video and learn more and discover the “Power of We.” To learn more about this exciting opportu…",False,False,"Glendale, Denver",$105k-$105k,104858.95,104858.95,False,False,2025-10-24T12:53:35Z,https://www.adzuna.com/details/5462925299?utm_medium=api&utm_source=4ad8a509,Healthcare & Nursing Jobs,,500,adzuna,2025-10-24
5462925238,Intermountain Health,Radiology Technologist,"Job Description: Radiology Technologists at Intermountain Health are committed to providing patient centered care while demonstrating our values of Integrity, Trust, Excellence, Accountability, and Mutual Respect. If you are interested in contributing to our mission of helping people live the healthiest lives possible- come join our team! What does it mean to be a caregiver with Intermountain? Check out this video and learn more and discover the “Power of We.” To learn more about this exciting …",False,False,"Wheat Ridge, Jefferson County",$98k-$98k,98311.51,98311.51,False,False,2025-10-24T12:53:34Z,https://www.adzuna.com/details/5462925238?utm_medium=api&utm_source=4ad8a509,Healthcare & Nursing Jobs,,500,adzuna,2025-10-24
5462924937,Hugging Face,Hub Success Engineer - US Remote,"At Hugging Face, we’re on a journey to democratize good AI. We are building the fastest growing platform for AI builders with over 10 million users & 100k organizations who collectively shared over 2M models, 500k datasets & 300k apps. Our open-source libraries have more than 600k stars on Github. We focus on developing open-source tools and models that push the boundaries of AI while remaining efficient and user-friendly. About the Role We’re looking for a Hub Success Engineer passionate about…",False,True,"New York City, New York",$193k-$193k,193365.7,193365.7,False,False,2025-10-24T12:53:11Z,https://www.adzuna.com/details/5462924937?utm_medium=api&utm_source=4ad8a509,IT Jobs,,500,adzuna,2025-10-24
