job_id,company,role,description,has_ai_keywords,is_remote,location,salary,salary_min,salary_max,requires_python,requires_js,created_date,redirect_url,category,contract_type,text_length,source,scraped_date
5462915470,Nominal,Production Engineer,"Job Description Job Description About Nominal Nominal is building the software infrastructure powering the world’s most advanced hardware systems — from spacecraft and autonomous vehicles to next-generation industrial machines. Our platform ingests high-rate telemetry, validates complex autonomy software in real time, and enables engineers to iterate faster without sacrificing safety or precision. We’re a small, fast-moving team of engineers and operators who own problems end-to-end, work acros…",False,False,"Austin, Travis County",$95k-$95k,94798.41,94798.41,False,False,2025-10-24T12:50:37Z,https://www.adzuna.com/details/5462915470?utm_medium=api&utm_source=4ad8a509,Engineering Jobs,,500,adzuna,2025-10-24
5462915420,Aircall,Partner Account Manager - San Francisco,"Job Description Job Description Aircall is the world’s leading integrated customer communications and intelligence platform for growing businesses. Trusted by over 20,000 companies worldwide, Aircall unifies voice and digital channels into one seamless platform, offering one-click integrations with leading CRMs and over 100 business tools. With real-time, AI-powered insights and feedback, AI agents, and automation, we help sales and support teams save time on routine tasks, uncover opportunitie…",False,False,"Seattle, King County",$120k-$120k,120343.66,120343.66,False,False,2025-10-24T12:50:37Z,https://www.adzuna.com/details/5462915420?utm_medium=api&utm_source=4ad8a509,Sales Jobs,,500,adzuna,2025-10-24
5462915423,Catalant,"Senior Client Partner, (Sr. Account Executive) Consumer Team","Job Description Job Description As the pioneer of Consulting 2.0, Catalant gives the world’s leading companies on-demand access to a community of highly vetted independent consultants and former operators. From individual consultants to full project teams, we deliver the right expertise to solve our clients’ most important challenges. Our clients include more than 30% of the Fortune 500, top private equity firms, and global consultancies, all seeking a more flexible, cost-effective way to get h…",False,False,US,$95k-$95k,95208.57,95208.57,False,False,2025-10-24T12:50:37Z,https://www.adzuna.com/details/5462915423?utm_medium=api&utm_source=4ad8a509,Sales Jobs,,500,adzuna,2025-10-24
5462915460,TTEC Digital,"VP, Sales Executive - AWS","Job Description Job Description TTEC Digital is a recognized leader in delivering comprehensive enterprise solutions on AWS. As a top AWS partner, we have successfully completed over 500 deployments and have earned multiple Partner of the Year awards. Our expertise spans the entire AWS ecosystem, including AI/ML services, data analytics, cloud infrastructure, CRM solutions, and customer experience technologies, enabling our clients to transform their businesses and achieve outstanding outcomes …",False,False,"Austin, Travis County",$193k-$193k,193438.73,193438.73,False,False,2025-10-24T12:50:37Z,https://www.adzuna.com/details/5462915460?utm_medium=api&utm_source=4ad8a509,Sales Jobs,,500,adzuna,2025-10-24
5462915462,Liz's Company,Cirrus Logic Demo-er,"Job Description Job Description Liz's Amazing Company is a leading supplier of low-power, high-precision mixed-signal processing solutions for mobile and consumer applications. The company has a robust portfolio of sophisticated low-power products including boosted amplifiers, smart codecs, camera controllers, haptic driver and sensing solutions, power conversion and control ICs, and fast-charging ICs. These solutions have innovative technology, software and associated algorithms incorporated. …",False,False,"Austin, Travis County",$119k-$119k,118619.0,118619.0,False,False,2025-10-24T12:50:37Z,https://www.adzuna.com/details/5462915462?utm_medium=api&utm_source=4ad8a509,IT Jobs,,500,adzuna,2025-10-24
5462915444,"Contact Government Services, LLC",IT Litigation Support,"Job Description Job Description IT Litigation Support Employment Type: Full Time, Mid level Department: Information Technology Contact Government Services is looking for a Litigation Support Technician to work at the United States Attorney's Office. As a Litigation Support Technician for CGS, you will be responsible for providing technical and analytical assistance involving Litigation Support of the United States Attorney's office. CGS brings motivated, highly skilled, and creative people toge…",False,False,"Washington, Washington, D.C.",$102k-$102k,101898.12,101898.12,False,False,2025-10-24T12:50:37Z,https://www.adzuna.com/details/5462915444?utm_medium=api&utm_source=4ad8a509,IT Jobs,,500,adzuna,2025-10-24
5462915386,Er-Meds,Physician - Hospitalist Position - Nocturnist - Anderson Hospital,"Job Description Job Description MEDS operates a renowned network of emergency physician and APP peers across both rural and urban communities in the Midwest. As a physician-owned practice founded in 1983, MEDS offers the care standards found in larger health systems while maintaining the personalized service of private practice. Our physicians continue to practice in hospital emergency departments and hospitalist roles in addition to serving in leadership roles. With a focus on expanding access…",False,False,"Maryville, Madison County",$179k-$179k,179096.7,179096.7,False,False,2025-10-24T12:50:36Z,https://www.adzuna.com/details/5462915386?utm_medium=api&utm_source=4ad8a509,Healthcare & Nursing Jobs,,500,adzuna,2025-10-24
5462915385,Uncountable,Content Marketing Manager,"Job Description Job Description About Uncountable: Uncountable is an innovative B2B SaaS company providing an AI-driven Laboratory Informatics platform for R&D organizations. Uncountable is transforming how R&D enterprises operate—replacing siloed and fragmented legacy data systems and Excel spreadsheets in the lab with a unified software designed to accelerate scientific product development and innovation. We help scientists maximize utilization of their experimental data, automate the capture…",False,False,"New York City, New York",$94k-$94k,93693.17,93693.17,False,False,2025-10-24T12:50:36Z,https://www.adzuna.com/details/5462915385?utm_medium=api&utm_source=4ad8a509,"PR, Advertising & Marketing Jobs",,500,adzuna,2025-10-24
5462915389,The Voleon Group,"Senior Associate, Investor Relations and Business Development","Job Description Job Description Voleon is a technology company that applies state-of-the-art AI and machine learning techniques to real-world problems in finance. For nearly two decades, we have led our industry and worked at the frontier of applying AI/ML to investment management. We have become a multibillion-dollar asset manager, and we have ambitious goals for the future. Your colleagues will include internationally recognized experts in artificial intelligence and machine learning research…",True,False,"Berkeley, Alameda County",$125k-$125k,124589.13,124589.13,False,False,2025-10-24T12:50:36Z,https://www.adzuna.com/details/5462915389?utm_medium=api&utm_source=4ad8a509,Sales Jobs,,500,adzuna,2025-10-24
5462915387,TSMG,Operations (Ops) Team Lead,"Job Description Job Description The Operations (Ops) Team Lead role assists in overseeing day-to-day operations, providing guidance and management where needed to the Drivers. The Ops Lead reports to the Country Manager. Primary Responsibilities: Manage team of Data Collection Driving Operations field resources Drives day-to-day operations following standard operating procedures Assist in identifying knowledge gaps, coaching, mentoring and the professional development field surveyors Conduct pe…",False,False,"Boston, Suffolk County",$61k-$61k,61211.88,61211.88,False,False,2025-10-24T12:50:36Z,https://www.adzuna.com/details/5462915387?utm_medium=api&utm_source=4ad8a509,Logistics & Warehouse Jobs,,500,adzuna,2025-10-24
5462915395,Bisnow,Account Manager,"Job Description Job Description Biscred is the go-to sales intelligence and prospecting platform for the commercial real estate industry. Our mission is to equip sales professionals with the data and insights they need to accelerate deal cycles and boost revenue. This hybrid role is based either in Boston, Jacksonville or NYC, with in-office work required three days a week either at 100 Summer St. or 711 Atlantic Ave Boston, 25 N Market St, Jacksonville, FL or 123 William St. NY, NY. As an Acco…",False,False,"New York City, New York",$91k-$91k,90708.84,90708.84,False,False,2025-10-24T12:50:36Z,https://www.adzuna.com/details/5462915395?utm_medium=api&utm_source=4ad8a509,Sales Jobs,,500,adzuna,2025-10-24
5462915393,The Voleon Group,Head of Feature Engineering,"Job Description Job Description Voleon is a technology company that applies state-of-the-art AI and machine learning techniques to real-world problems in finance. For nearly two decades, we have led our industry and worked at the frontier of applying AI/ML to investment management. We have become a multibillion-dollar asset manager, and we have ambitious goals for the future. Your colleagues will include internationally recognized experts in artificial intelligence and machine learning research…",True,False,"Berkeley, Alameda County",$169k-$169k,168539.5,168539.5,False,False,2025-10-24T12:50:36Z,https://www.adzuna.com/details/5462915393?utm_medium=api&utm_source=4ad8a509,Engineering Jobs,,500,adzuna,2025-10-24
5462915408,"Contact Government Services, LLC",Senior Help Desk Technician,"Job Description Job Description Senior Help Desk Technician Employment Type: Full Time Department: Help Desk CGS seeks a Senior Help Desk Technician to fulfill the requirements of Level 1 & 2 Help Desk (PC Assist) support services to end users consisting of senior management, attorneys, support staff, contractors, and associated systems for the Executive Office for the United States Attorneys (EOUSA). CGS brings motivated, highly skilled, and creative people together to solve the government’s m…",False,False,"Dallas, Texas",$84k-$84k,83541.71,83541.71,False,False,2025-10-24T12:50:36Z,https://www.adzuna.com/details/5462915408?utm_medium=api&utm_source=4ad8a509,IT Jobs,,500,adzuna,2025-10-24
5462915293,Speechify,"Software Engineer, iOS Core Product - Los Angeles, USA","Job Description Job Description The mission of Speechify is to make sure that reading is never a barrier to learning. Over 50 million people use Speechify's text-to-speech products to turn whatever they're reading – PDFs, books, Google Docs, news articles, websites – into audio, so they can read faster, read more, and remember more. Speechify's text-to-speech reading products include its iOS app, Android App, Mac App, Chrome Extension, and Web App. Google recently named Speechify the Chrome Ext…",False,False,"Los Angeles, Los Angeles County",$193k-$193k,192825.03,192825.03,False,False,2025-10-24T12:50:35Z,https://www.adzuna.com/details/5462915293?utm_medium=api&utm_source=4ad8a509,IT Jobs,,500,adzuna,2025-10-24
5462915296,Pirkey Barber,HR Business Partner,"Job Description Job Description Lever encourages curiosity, innovation, disruptive spirit and freedom to experience. We are serious but we don’t take ourselves too seriously! Our passion, our sense of detail, the extreme attention we pay to details, to the others and to our environment characterizes us and nourishes our unconventional vision of the world: a colorful, happy, and generous one! This bold attitude makes our difference. Our HR teams invest heavily in our talent, both at our corporat…",False,False,"San Francisco, California",$81k-$81k,81307.08,81307.08,False,False,2025-10-24T12:50:35Z,https://www.adzuna.com/details/5462915296?utm_medium=api&utm_source=4ad8a509,HR & Recruitment Jobs,,500,adzuna,2025-10-24
5462915310,Above and Beyond Therapy,Board Certified Behavior Analyst (BCBA),"Job Description Job Description Above and Beyond Therapy is looking for exceptional Board Certified Behavior Analysts (BCBAs) to join our team. We invest in the delivery of outstanding quality care by designing an environment where all employees can think big and have fun. Our company goal is, that you should love what you do! Above and Beyond Therapy is dedicated to the professional growth and personal happiness of all of our staff. We constantly strive to create a supportive, collaborative, i…",False,False,"Miami, Miami-Dade County",$80k-$80k,79788.77,79788.77,False,False,2025-10-24T12:50:35Z,https://www.adzuna.com/details/5462915310?utm_medium=api&utm_source=4ad8a509,Healthcare & Nursing Jobs,,500,adzuna,2025-10-24
5462915351,"CESO, Inc.",Senior Project Manager,"Job Description Job Description Are you a Senior Project Manager in the Architecture, Engineering, and Construction field seeking purpose, challenge, and talented colleagues? With a diverse portfolio of residential, energy, commercial, light industrial and public programs, CESO has the opportunity for you to develop your career. We develop leaders and empower our associates to use their skills and talents to positively impact the world through service – to our coworkers, clients, and communitie…",False,False,"Dallas, Texas",$99k-$99k,98865.29,98865.29,False,False,2025-10-24T12:50:35Z,https://www.adzuna.com/details/5462915351?utm_medium=api&utm_source=4ad8a509,Engineering Jobs,,500,adzuna,2025-10-24
5462915068,Jerry.ai,"Product Manager, AI Powered Messaging","Job Description Job Description About Jerry.ai Jerry.ai is building America’s first and only AI-powered super app to radically simplify car ownership. We are redefining how people manage owning a car, one of their most expensive and time-consuming assets. We are the 1 rated and most downloaded app in our category with a 4.7 star rating in the App Store. We have more than 5 million users, and have helped millions find better auto insurance — and we’re just getting started. About the Opportunity …",False,False,"Atlanta, Fulton County",$146k-$146k,145572.1,145572.1,False,False,2025-10-24T12:50:33Z,https://www.adzuna.com/details/5462915068?utm_medium=api&utm_source=4ad8a509,IT Jobs,,500,adzuna,2025-10-24
5462914976,Lovelytics,Solution Architect,"Job Description Job Description Lovelytics is a Databricks-focused data and AI consulting firm specializing in artificial intelligence, data, and analytics solutions. Since partnering with Databricks in 2019, Lovelytics has experienced exponential growth, growing from 50 people to over 340 over the past 3 years. Lovelytics is a trusted partner for many of the most high-profile enterprise clients in Media & Entertainment, Manufacturing, Retail & CPG, Healthcare & Life Sciences, and Financial Ser…",True,False,"Arlington, Arlington County",$156k-$156k,155882.62,155882.62,False,False,2025-10-24T12:50:31Z,https://www.adzuna.com/details/5462914976?utm_medium=api&utm_source=4ad8a509,IT Jobs,,500,adzuna,2025-10-24
5462914965,"Essent Guaranty, Inc.",Systems Engineer/Developer,"Job Description Job Description Essent Group Ltd. (NYSE: ESNT) is a Bermuda-based holding company (collectively with its subsidiaries, ""Essent"") which serves the housing finance industry by offering private mortgage insurance, reinsurance, risk management products and title insurance and settlement services to mortgage lenders, borrowers, and investors to support homeownership. We are focused on managing risk and dedicated to serving as a strong and fair counterparty. As a company, we bring str…",False,False,"Radnor, Delaware County",$78k-$78k,77749.15,77749.15,False,False,2025-10-24T12:50:31Z,https://www.adzuna.com/details/5462914965?utm_medium=api&utm_source=4ad8a509,IT Jobs,,500,adzuna,2025-10-24
5462914781,RadNet,Mammography Technologist,"Job Description Job Description Responsibilities Artificial Intelligence; Advanced Technology; The very best in patient care. With decades of expertise, we are Leading Radiology Forward . With dynamic cross-training and advancement opportunities in a team-focused environment, the core of our success is its people with the commitment to a better healthcare experience. When you join us as a Mammography Technologist, you will be joining a dedicated team of professionals who deliver quality, value,…",True,False,"Bowie, Prince George's County",$58k-$58k,57792.04,57792.04,False,False,2025-10-24T12:50:29Z,https://www.adzuna.com/details/5462914781?utm_medium=api&utm_source=4ad8a509,Healthcare & Nursing Jobs,,500,adzuna,2025-10-24
5462914475,Metropolis,"Director, Business Development","Job Description Job Description Who we are Metropolis is an artificial intelligence company that uses computer vision technology to enable frictionless, checkout-free experiences in the real world. Today, we are reimagining parking to enable millions of consumers to just ""drive in and drive out."" We envision a future where people transact in the real world with a speed, ease and convenience that is unparalleled, even online. Tomorrow, we will power checkout-free experiences anywhere you go to m…",True,True,"Philadelphia, Philadelphia County",$179k-$179k,179174.44,179174.44,False,False,2025-10-24T12:50:28Z,https://www.adzuna.com/details/5462914475?utm_medium=api&utm_source=4ad8a509,Sales Jobs,,500,adzuna,2025-10-24
5462914444,SP+,Operations Manager - The Residences Water Square,"Job Description Job Description Overview SP, a Metropolis company, is an artificial intelligence company for the real world. We use computer vision to enable checkout-free parking experiences. So there’s no fumbling with tickets, machines, apps, or credit cards. You just “drive in and drive out.” We are the largest parking network in America, with over 23,000 employees powering mobility at over 4,000 locations across North America and Europe. Today, we are reinventing parking. Because it’s impo…",True,False,"Detroit, Wayne County",$56k-$56k,55854.79,55854.79,False,False,2025-10-24T12:50:27Z,https://www.adzuna.com/details/5462914444?utm_medium=api&utm_source=4ad8a509,HR & Recruitment Jobs,,500,adzuna,2025-10-24
5462914398,SP+,Attendant,"Job Description Job Description Overview SP, a Metropolis company, is an artificial intelligence company for the real world. We use computer vision to enable checkout-free parking experiences. So there’s no fumbling with tickets, machines, apps, or credit cards. You just “drive in and drive out.” We are the largest parking network in America, with over 23,000 employees powering mobility at over 4,000 locations across North America and Europe. Today, we are reinventing parking. Because it’s impo…",True,False,"Charlotte, Mecklenburg County",$39k-$39k,39032.25,39032.25,False,False,2025-10-24T12:50:27Z,https://www.adzuna.com/details/5462914398?utm_medium=api&utm_source=4ad8a509,Travel Jobs,,500,adzuna,2025-10-24
5462914167,SP+,Maintenance Porter,"Job Description Job Description Overview SP, a Metropolis company, is an artificial intelligence company for the real world. We use computer vision to enable checkout-free parking experiences. So there’s no fumbling with tickets, machines, apps, or credit cards. You just “drive in and drive out.” We are the largest parking network in America, with over 23,000 employees powering mobility at over 4,000 locations across North America and Europe. Today, we are reinventing parking. Because it’s impo…",True,False,"Roanoke, Roanoke County",$28k-$28k,28002.29,28002.29,False,False,2025-10-24T12:50:25Z,https://www.adzuna.com/details/5462914167?utm_medium=api&utm_source=4ad8a509,Maintenance Jobs,,500,adzuna,2025-10-24
5462913988,Xplor,Account Executive,"Job Description Job Description Company Description At Xplor, we believe that helping people make the most of each day is the most rewarding way to spend ours. We give small and medium-sized businesses cloud-based, intuitive technology solutions that enable them to manage all the hassles of running and growing a business, so business owners can get back to doing what they love. With Xplor Pay, we help businesses get paid quickly and securely – without hidden fees. We built the tech ourselves, a…",False,False,"Saint Albans, Franklin County",$93k-$93k,92874.02,92874.02,False,False,2025-10-24T12:50:23Z,https://www.adzuna.com/details/5462913988?utm_medium=api&utm_source=4ad8a509,Sales Jobs,,500,adzuna,2025-10-24
5462913705,SP+,Valet Driver,"Job Description Job Description Overview SP, a Metropolis company, is an artificial intelligence company for the real world. We use computer vision to enable checkout-free parking experiences. So there’s no fumbling with tickets, machines, apps, or credit cards. You just “drive in and drive out.” We are the largest parking network in America, with over 23,000 employees powering mobility at over 4,000 locations across North America and Europe. Today, we are reinventing parking. Because it’s impo…",True,False,"Tucson, Pima County",$45k-$45k,44905.93,44905.93,False,False,2025-10-24T12:50:20Z,https://www.adzuna.com/details/5462913705?utm_medium=api&utm_source=4ad8a509,HR & Recruitment Jobs,,500,adzuna,2025-10-24
5462913389,ABM.Com,Lead Building Engineer,"Job Description Job Description ABM, a leading provider of integrated facility solutions, is looking for a Lead Building Engineer. The Building Engineer supports the designated leadership with the daily operations of all building systems. This includes hard surface maintenance and repair, basic carpentry and metal work, operating, maintaining and repairing all facility system equipment associated with HVAC operations and mechanical and electrical systems. The Building Engineer will also respond…",False,False,"Seattle, King County",$71k-$71k,71294.59,71294.59,False,False,2025-10-24T12:50:19Z,https://www.adzuna.com/details/5462913389?utm_medium=api&utm_source=4ad8a509,Engineering Jobs,,500,adzuna,2025-10-24
5462913373,SkyGrid,Autonomy Engineer II,"Job Description Job Description SkyGrid, a Boeing Company, exists to open the sky for autonomous flight. Based in Austin, Texas, SkyGrid builds ground based high-assurance third-party services to enable the safe operations and airspace integration of highly automated and autonomous aircraft. SkyGrid also acts as a key operational nexus for advanced air mobility, integrating and managing data, infrastructure, access, and traffic to support seamless and efficient air traffic services. SkyGrid is …",False,False,"Austin, Travis County",$114k-$114k,113895.41,113895.41,False,False,2025-10-24T12:50:19Z,https://www.adzuna.com/details/5462913373?utm_medium=api&utm_source=4ad8a509,Engineering Jobs,,500,adzuna,2025-10-24
5462912917,Lilt,Staff DevOps Engineer (Security Clearance Required),"Job Description Job Description About LILT AI is changing how the world communicates — and LILT is leading that transformation. We're on a mission to make the world's information accessible to everyone , regardless of the language they speak. We use cutting-edge AI, machine translation, and human-in-the-loop expertise to translate content faster, more accurately, and more cost-effectively without compromising on brand, voice, or quality. At LILT, we empower our teammates with leading tools, glo…",False,False,"Washington, Washington, D.C.",$172k-$172k,171941.36,171941.36,False,False,2025-10-24T12:50:14Z,https://www.adzuna.com/details/5462912917?utm_medium=api&utm_source=4ad8a509,Engineering Jobs,,500,adzuna,2025-10-24
5462912852,Varo Bank,Sr. Security Engineer,"Job Description Job Description Varo is an entirely new kind of bank. All digital, mission-driven, FDIC insured and designed for the way our customers live their lives. A bank for all of us. We are looking for an experienced Senior Security Engineer responsible for leading the vulnerability and patch management program. The ideal candidate will be responsible for the end-to-end management of our macOS and Windows endpoint patching processes. This role is critical in ensuring the security, stabi…",False,False,"Atlanta, Fulton County",$94k-$94k,93531.14,93531.14,False,False,2025-10-24T12:50:14Z,https://www.adzuna.com/details/5462912852?utm_medium=api&utm_source=4ad8a509,IT Jobs,,500,adzuna,2025-10-24
5462912873,Andersen Corporation/Renewal by Andersen,Direct Marketing Associate - Greater Capital Region,"Job Description Job Description Join our growing team of Capital Region Area Direct Marketing Associates! Renewal by Andersen is the full-service replacement window division of Andersen Corporation. We are united by the common goal of making a difference in the lives of our homeowners and the communities we serve. We are looking for a Direct Marketing Associate in the greater DMV area. Renewal by Andersen is looking for an accomplished, driven, and collaborative Door-to-Door Canvasser to help p…",False,False,"Washington, Washington, D.C.",$67k-$67k,66862.95,66862.95,False,False,2025-10-24T12:50:14Z,https://www.adzuna.com/details/5462912873?utm_medium=api&utm_source=4ad8a509,Sales Jobs,,500,adzuna,2025-10-24
5462912913,Flow,Flow Experience Agent (Concierge),"Job Description Job Description About the Company At Flow, we’re reimagining what it means to live, work, and connect. More than just a real estate company, Flow is a brand, a technology platform, and an operations ecosystem spanning condominiums, hotels, multifamily residences, and office spaces. We’re building a new kind of living experience: one that’s flexible, connected, and designed to create genuine community and real value for the people who call Flow home. Our mission is oneness: prior…",False,False,"Miami, Miami-Dade County",$28k-$28k,28114.17,28114.17,False,False,2025-10-24T12:50:14Z,https://www.adzuna.com/details/5462912913?utm_medium=api&utm_source=4ad8a509,Admin Jobs,,500,adzuna,2025-10-24
