job_id,company,role,description,has_ai_keywords,is_remote,location,salary,salary_min,salary_max,requires_python,requires_js,created_date,redirect_url,category,contract_type,text_length,source,scraped_date
5462921509,TSMG,"Driver in Clinton, TN","Job Description Job Description Company description Terry Soot Management Group (TSMG) is a field data collection company founded in 2017 in Europe. We collect data where automation is not possible. We count features, take pictures, make videos, record speech, and scan areas for every detail you need to make more informed decisions. Our field data collection teams are spread across Europe and North America, ready to accept new challenges. Project objective The goal of the project is to help col…",False,False,"Clinton, Anderson County",$77k-$77k,77011.05,77011.05,False,False,2025-10-24T12:52:10Z,https://www.adzuna.com/details/5462921509?utm_medium=api&utm_source=4ad8a509,IT Jobs,,500,adzuna,2025-10-24
5462921489,Greenlight Financial Technology,"VP Engineering, Quality & Tools","Job Description Job Description Greenlight is the leading family fintech company on a mission to help parents raise financially smart kids. We proudly serve more than 6 million parents and kids with our award-winning banking app for families. With Greenlight, parents can automate allowance, manage chores, set flexible spend controls, and invest for their family’s future. Kids and teens learn to earn, save, spend wisely, and invest. At Greenlight, we believe every child should have the opportuni…",False,False,US,$154k-$154k,154338.89,154338.89,False,False,2025-10-24T12:52:10Z,https://www.adzuna.com/details/5462921489?utm_medium=api&utm_source=4ad8a509,IT Jobs,,500,adzuna,2025-10-24
5462921501,"Contact Government Services, LLC",Senior eDiscovery Technical Advisor (Top Secret Clearance Required),"Job Description Job Description Senior eDiscovery Technical Advisor Employment Type: Full-Time, Executive-Level Department: Legal CGS is seeking a dedicated Senior eDiscovery Technical Advisor to join a fast-paced and hard-working team to assist with any legal accounts. As an eDiscovery Technical Advisor, you will play a key role in supporting various aspects of the company's portfolio. CGS brings motivated, highly skilled, and creative people together to solve the government’s most dynamic pro…",False,False,"New York City, New York",$169k-$169k,168700.95,168700.95,False,False,2025-10-24T12:52:10Z,https://www.adzuna.com/details/5462921501?utm_medium=api&utm_source=4ad8a509,IT Jobs,,500,adzuna,2025-10-24
5462921400,Alloy.ai,Sales Development Representative,"Job Description Job Description About Alloy.ai At Alloy.ai, we work with consumer goods companies that make the products we eat, wear, and use every day, as well as the ones we occasionally splurge on. We’re tackling a real and complex problem for them—managing supply and demand in the face of constantly changing customer behavior, highly complex supply chain networks, 40-year-old data standards and labor-intensive manual processes. Alloy.ai is a fast-growing, well-funded startup with an expand…",False,False,"Denver, Colorado",$93k-$93k,92714.02,92714.02,False,False,2025-10-24T12:52:09Z,https://www.adzuna.com/details/5462921400?utm_medium=api&utm_source=4ad8a509,Sales Jobs,,500,adzuna,2025-10-24
5462921399,Dream Golf,Afternoon Housekeeper @ Bandon Dunes Golf Resort,"Job Description Job Description At Bandon Dunes, we don’t take shortcuts—especially when it comes to making someone’s stay unforgettable. As a Housekeeper, you’re not just making beds and wiping counters. You’re part of the guest experience. When someone walks into a freshly cleaned room and exhales, “Wow”—that’s because of you. This role is about more than bleach and vacuums. It’s about care. It’s about taking pride in your work, paying attention to the small details that others might miss, an…",False,False,"Bandon, Coos County",$53k-$53k,53484.18,53484.18,False,False,2025-10-24T12:52:09Z,https://www.adzuna.com/land/ad/5462921399?se=_hpTv_6w8BGrA4crpEIj3A&utm_medium=api&utm_source=4ad8a509&v=625CD0D0E1DF4BDB7F25BB334A3F0BD62D8785BB,Hospitality & Catering Jobs,,500,adzuna,2025-10-24
5462921417,GoPuff,"Retail Sales Associate, Turlock, 425","Job Description Job Description The Retail Sales Associate is responsible for providing an excellent customer experience and performing duties as assigned including, but not limited to, cashier, sales floor merchandising, replenishment, receiving and e-commerce fulfillment. What We Offer Medical/Dental/Vision Insurance (for full-time employees) 401(k) Retirement Savings Plan 25% employee discount & FAM Membership Vacation and Sick Time for eligible employees EAP through AllOne Health (formerly …",True,False,"Turlock, Stanislaus County",$38k-$38k,37728.17,37728.17,False,False,2025-10-24T12:52:09Z,https://www.adzuna.com/details/5462921417?utm_medium=api&utm_source=4ad8a509,Retail Jobs,,500,adzuna,2025-10-24
5462921415,"Contact Government Services, LLC",Relativity SME,"Job Description Job Description Relativity SME Employment Type: Full-Time, Experienced Department: eDiscovery CGS is seeking a Relativity SME to join our team, you will join an experienced team and work directly with Relativity’s staff as needed to resolve software-specific issues. You will also play a key role in testing Relativity software releases as well as setting up and establishing templates, views, scripts, or workflows used across all workspaces or the workspaces of an entire division.…",False,False,"New York City, New York",$192k-$192k,192283.12,192283.12,False,False,2025-10-24T12:52:09Z,https://www.adzuna.com/details/5462921415?utm_medium=api&utm_source=4ad8a509,IT Jobs,,500,adzuna,2025-10-24
5462921396,The Voleon Group,Senior Network Engineer,"Job Description Job Description Voleon is a technology company that applies state-of-the-art AI and machine learning techniques to real-world problems in finance. For nearly two decades, we have led our industry and worked at the frontier of applying AI/ML to investment management. We have become a multibillion-dollar asset manager, and we have ambitious goals for the future. Your colleagues will include internationally recognized experts in artificial intelligence and machine learning research…",True,False,"New York City, New York",$215k-$215k,214603.9,214603.9,False,False,2025-10-24T12:52:09Z,https://www.adzuna.com/details/5462921396?utm_medium=api&utm_source=4ad8a509,IT Jobs,,500,adzuna,2025-10-24
5462921408,Arista Networks,Network Systems Engineer (Pre-Sales),"Job Description Job Description Company Description Arista Networks is an industry leader in data-driven, client-to-cloud networking for large data center, campus and routing environments. What sets us apart is our relentless pursuit of innovation. We leverage the latest advancements in cloud computing, artificial intelligence, and software-defined networking to provide our clients with a competitive edge in an increasingly interconnected world. Our solutions are designed to not only meet the c…",True,False,"Albany, Albany County",$151k-$151k,151421.42,151421.42,False,False,2025-10-24T12:52:09Z,https://www.adzuna.com/details/5462921408?utm_medium=api&utm_source=4ad8a509,IT Jobs,,500,adzuna,2025-10-24
5462921397,Murgado Automotive Group,Acura Finance Manager,"Job Description Job Description Acura Highland Park is part of one of the best automotive groups (Murgado Automotive Group) in the country. We strongly believe that our team is what makes our dealerships best in class. When you join our team, you become more than an employee; you become part of a friendly, tight-knit family. We care about you and your dreams, ambitions and goals. And the opportunity for growth is endless. We only promote from within our company and the sky is the limit. The Fin…",False,False,"Highland Park, Lake County",$49k-$49k,48789.52,48789.52,False,False,2025-10-24T12:52:09Z,https://www.adzuna.com/details/5462921397?utm_medium=api&utm_source=4ad8a509,Sales Jobs,,500,adzuna,2025-10-24
5462921393,"Jupiter Intelligence, Inc.",Account Executive Climate Analytics - Finance,"Job Description Job Description About Us Jupiter is the global market leader in analytics for resilience planning and enterprise climate risk management. We are led by pioneers in data, climate, and earth and ocean sciences, as well as technology, risk management, company building, and public policy. Our climate risk modeling solutions save lives and mitigate potentially catastrophic impacts inflicted by hurricanes, floods, heat waves, wildfires, drought, and other extreme weather events on hom…",False,False,"San Mateo, San Mateo County",$103k-$103k,103407.67,103407.67,False,False,2025-10-24T12:52:09Z,https://www.adzuna.com/details/5462921393?utm_medium=api&utm_source=4ad8a509,Accounting & Finance Jobs,,500,adzuna,2025-10-24
5462921132,"Contact Government Services, LLC",Senior Systems Administrator II,"Job Description Job Description Senior Systems Administrator II Employment Type: Full Time, Senior-level Department: Legal/IT CGS is seeking a Senior Systems Administrator to join our team supporting a wide-ranging technical support initiative for a large Federal agency. CGS brings motivated, highly skilled, and creative people together to solve the government’s most dynamic problems with cutting-edge technology. To carry out our mission, we are seeking candidates who are excited to contribute …",False,False,"Los Angeles, Los Angeles County",$142k-$142k,142179.31,142179.31,False,False,2025-10-24T12:52:07Z,https://www.adzuna.com/details/5462921132?utm_medium=api&utm_source=4ad8a509,IT Jobs,,500,adzuna,2025-10-24
5462921148,Demo Site,Account Manager,"Job Description Job Description Join a scaling, tight-knit team that’s working directly with innovative talent acquisition teams and thought leaders across various industries and geographies to make hiring a strategic advantage for their organizations. You'll serve as an advisor to our customers and take a consultative approach to ensure customers are setup for long-term success as high performing hiring organizations using the Lever product suite. As a Customer Success Manager on the Customer …",False,False,"Kansas City, Jackson County",$74k-$74k,74296.66,74296.66,False,False,2025-10-24T12:52:07Z,https://www.adzuna.com/details/5462921148?utm_medium=api&utm_source=4ad8a509,IT Jobs,,500,adzuna,2025-10-24
5462921136,Above and Beyond Therapy,Board Certified Behavior Analyst (BCBA) Hybrid,"Job Description Job Description We are looking for local BCBAs to join our team throughout the state of Virginia Above and Beyond Therapy is looking for exceptional Board Certified Behavior Analysts (BCBAs) to join our team. We invest in the delivery of outstanding quality care by designing an environment where all employees can think big and have fun. Our company goal is, that you should love what you do! Above and Beyond Therapy is dedicated to the professional growth and personal happiness o…",False,False,"Newport News, Newport News City",$76k-$76k,75613.05,75613.05,False,False,2025-10-24T12:52:07Z,https://www.adzuna.com/details/5462921136?utm_medium=api&utm_source=4ad8a509,Healthcare & Nursing Jobs,,500,adzuna,2025-10-24
5462921129,Prime Time Consulting,Information Systems Security Engineer (ISSE) Skill Level 3,"Job Description Job Description Prime Time Consulting, a GRVTY Company, provides clients with expert intelligence analysis services. Our clients include defense contractors, industrial and service corporations, and departments and agencies of the U.S. Federal Government. We are actively searching for Information Systems Security Engineer (ISSE) Skill Level 3 , located in Maryland , to support our team. We have varying levels of this position, depending on years of experience and education. Esse…",False,False,"Annapolis Junction, Anne Arundel County",$136k-$136k,136326.8,136326.8,False,False,2025-10-24T12:52:07Z,https://www.adzuna.com/details/5462921129?utm_medium=api&utm_source=4ad8a509,IT Jobs,,500,adzuna,2025-10-24
5462921138,Self Guided Webinar,Data Analyst,"Job Description Job Description Responsibilities We may use artificial intelligence (AI) tools to support parts of the hiring process, such as reviewing applications, analyzing resumes, or assessing responses. These tools assist our recruitment team but do not replace human judgment. Final hiring decisions are ultimately made by humans. If you would like more information about how your data is processed, please contact us.",True,False,"San Francisco, California",$64k-$64k,64059.76,64059.76,False,False,2025-10-24T12:52:07Z,https://www.adzuna.com/details/5462921138?utm_medium=api&utm_source=4ad8a509,Trade & Construction Jobs,,426,adzuna,2025-10-24
5462921131,"Contact Government Services, LLC",eDiscovery Project Manager,"Job Description Job Description eDiscovery Project Manager Employment Type: Full-Time, Experienced Department: eDiscovery Management CGS is seeking an eDiscovery Project Manager to join our team supporting the legal organization within a large Federal agency. CGS brings motivated, highly skilled, and creative people together to solve the government’s most dynamic problems with cutting-edge technology. To carry out our mission, we are seeking candidates who are excited to contribute to governmen…",False,False,"Philadelphia, Philadelphia County",$136k-$136k,135754.9,135754.9,False,False,2025-10-24T12:52:07Z,https://www.adzuna.com/details/5462921131?utm_medium=api&utm_source=4ad8a509,IT Jobs,,500,adzuna,2025-10-24
5462921144,WorkOS,Product Engineer - AuthKit,"Job Description Job Description About WorkOS \uD83D\uDE80 WorkOS builds tools and services for developers to help them implement authentication, identity, authorization, and overall enterprise readiness. We’re a fully distributed team with employees across North American time zones. We’re well-funded, having raised $100m in funding from top investors including Greenoaks Capital, Lachy Groom, and Lightspeed Ventures. Our fast-growing customer base includes rapidly growing SaaS companies like Ope…",False,True,"Seattle, King County",$173k-$173k,173153.45,173153.45,False,False,2025-10-24T12:52:07Z,https://www.adzuna.com/details/5462921144?utm_medium=api&utm_source=4ad8a509,IT Jobs,,500,adzuna,2025-10-24
5462921126,Bisnow,Director of Development and Acquisitions,"Job Description Job Description The Director of Development and Acquisitions will lead efforts to identify, structure, and execute multi-family affordable/workforce housing development projects, while also supporting selective acquisition opportunities. The role emphasizes the full development lifecycle—from feasibility to close—within the West Coast markets (California, Washington and Oregon). Job Responsibilities Development Leadership: Lead real estate development projects from concept throu…",False,False,"Los Angeles, Los Angeles County",$108k-$108k,108346.33,108346.33,False,False,2025-10-24T12:52:07Z,https://www.adzuna.com/details/5462921126?utm_medium=api&utm_source=4ad8a509,Property Jobs,,500,adzuna,2025-10-24
5462921125,Kobie Marketing,Sr. Software Engineer,"Job Description Job Description Join a National Top Workplace Named a Top Workplace in the USA and Top Remote Workplace, Kobie is where the best minds in loyalty come together, driven by passion and innovation. We’re always looking for talented individuals who are ready to join a collaborative, growth-focused culture. As a partner to some of the world’s most recognized brands, we are leaders in loyalty, helping brands build lasting emotional connections with their consumers. Join Us from Anywhe…",False,True,"Minneapolis, Hennepin County",$96k-$96k,96272.45,96272.45,False,False,2025-10-24T12:52:07Z,https://www.adzuna.com/details/5462921125?utm_medium=api&utm_source=4ad8a509,IT Jobs,,500,adzuna,2025-10-24
5462921128,Giving Home Health Care,Human Resource Business Partner,"Job Description Job Description Since 2012, Giving Home Health Care has been supporting individuals impacted by health conditions related to their work in nuclear facilities for the Department of Energy. With a focus on personalized, in-home care, we are committed to assisting those who have dedicated their careers to these vital roles. As a fast-growing, leading provider, we proudly serve patients across Arizona, Colorado, Kentucky, Missouri, Nevada, New Mexico, Tennessee, Texas, and Utah. If …",False,False,"Albuquerque, Bernalillo County",$112k-$112k,111804.05,111804.05,False,False,2025-10-24T12:52:07Z,https://www.adzuna.com/details/5462921128?utm_medium=api&utm_source=4ad8a509,HR & Recruitment Jobs,,500,adzuna,2025-10-24
5462921098,Planned Parenthood of Northern New England,Laboratory Manager & Technologist - Per diem,"Job Description Job Description POSITION TITLE: Laboratory Manager & Technologist - Per diem LOCATION : Barre, VT HOURS: Per Diem, Hourly (Non-Exempt) UNION MEMBERSHIP: This position is represented by AFT union in VT POSITION PURPOSE: Responsible for all aspects of the operation of an in-house high complexity laboratory in accordance with laboratory protocols. Utilizes lab information system to enter patient data, prepares specimens, performs tests using automated or semi-automated equipment, i…",False,False,"Barre, Washington County",$35k-$35k,34658.57,34658.57,False,False,2025-10-24T12:52:06Z,https://www.adzuna.com/land/ad/5462921098?se=ylcPw_6w8BGvH9RyxhK2tQ&utm_medium=api&utm_source=4ad8a509&v=FB0A3211B2F8373A524932837B0342BE1D3F4FFB,Scientific & QA Jobs,,500,adzuna,2025-10-24
5462921095,Wade Trim,Senior Project Manager - 2425.23,"Job Description Job Description What We Offer: Our excellent salary and benefits package includes medical, dental, vision, life insurance, short and long-term disability coverage, education reimbursement, 401(k), performance bonuses, and an employee stock program. Employee Resource Groups and Programs offered include the Young Professionals Group, Women at Wade Trim, Diversity, Equity and Inclusion, Professional Development, Leadership Development, Rotation Program, Mentor Program, Sustainabili…",False,False,"Cincinnati, Hamilton County",$104k-$104k,103991.15,103991.15,False,False,2025-10-24T12:52:06Z,https://www.adzuna.com/details/5462921095?utm_medium=api&utm_source=4ad8a509,Engineering Jobs,,500,adzuna,2025-10-24
5462921118,Medici,"Physician, Family or Internal Medicine - CORPUS CHRISTI, TEXAS","Job Description Job Description Family or Internal Medicine Physician, Corpus Christi, Texas At Health by Design, we’re not just treating symptoms—we’re transforming the way healthcare is delivered. Our mission-driven, patient-centered clinics focus on preventative care, wellness programs, lifestyle medicine, and education. We believe in treating the whole person and empowering patients to take control of their health journey. If you’re looking for a career where your work is meaningful, your p…",False,False,"Three Rivers, Live Oak County",$104k-$104k,104422.85,104422.85,False,False,2025-10-24T12:52:06Z,https://www.adzuna.com/details/5462921118?utm_medium=api&utm_source=4ad8a509,Healthcare & Nursing Jobs,,500,adzuna,2025-10-24
5462921116,Jerry.ai,"Manager, Customer Operations (Inbound Virtual Contact Center)","Job Description Job Description You could work anywhere. Why us? Join a pre-IPO startup with capital, traction and runway ($240M funded | 40X revenue growth in 4 years | $2T market size). Work closely with brilliant leaders and team mates from companies like McKinsey, BCG, Bain, Nvidia, GEICO, Better, Nerdwallet, a16z, etc. Disrupt a massive market and take us to a $5B business in the next few years. Be immersed in a talent-dense environment and greatly accelerate your career growth. About the …",False,True,"Portland, Multnomah County",$120k-$120k,119982.68,119982.68,False,False,2025-10-24T12:52:06Z,https://www.adzuna.com/details/5462921116?utm_medium=api&utm_source=4ad8a509,IT Jobs,,500,adzuna,2025-10-24
5462921089,"Contact Government Services, LLC",Cloud Systems Architect,"Job Description Job Description Cloud Systems Architect Employment Type: Full-Time, Mid-level Department: Information Technology We are seeking a Cloud Systems Architect with experience with cloud infrastructure to engineer and support public, private and hybrid clouds. The ideal candidate will be proficient in a variety of cloud hosts including Amazon Web Services and Microsoft Azure at a minimum. CGS brings motivated, highly skilled, and creative people together to solve the government’s most…",False,False,"Washington, Washington, D.C.",$139k-$139k,138890.64,138890.64,False,False,2025-10-24T12:52:06Z,https://www.adzuna.com/details/5462921089?utm_medium=api&utm_source=4ad8a509,IT Jobs,,500,adzuna,2025-10-24
5462921090,CertifID,Staff Data Engineer,"Job Description Job Description Cybercrime is rising, reaching record highs in 2024. According to the FBI's IC3 report total losses exceeded $16 billion. With investment fraud and BEC scams at the forefront, the message is clear: the real estate sector remains a lucrative target for cybercriminals. At CertifID, we take this threat seriously and provide a secure platform that verifies the identities of parties involved in transactions, authenticates wire transfer instructions, and detects potent…",False,False,"Austin, Travis County",$132k-$132k,131582.56,131582.56,False,False,2025-10-24T12:52:06Z,https://www.adzuna.com/details/5462921090?utm_medium=api&utm_source=4ad8a509,IT Jobs,,500,adzuna,2025-10-24
5462921051,Above and Beyond Therapy,Board Certified Behavior Analyst (BCBA),"Job Description Job Description Above and Beyond Therapy is looking for exceptional Board Certified Behavior Analysts (BCBAs) to join our team. We invest in the delivery of outstanding quality care by designing an environment where all employees can think big and have fun. Our company goal is, that you should love what you do! Above and Beyond Therapy is dedicated to the professional growth and personal happiness of all of our staff. We constantly strive to create a supportive, collaborative, i…",False,False,"Tallahassee, Leon County",$73k-$73k,72973.54,72973.54,False,False,2025-10-24T12:52:05Z,https://www.adzuna.com/details/5462921051?utm_medium=api&utm_source=4ad8a509,Healthcare & Nursing Jobs,,500,adzuna,2025-10-24
5462921047,Hermeus,Business Applications Developer,"Job Description Job Description Hermeus is a high-speed aircraft manufacturer focused on the rapid design, build, and test of high-Mach and hypersonic aircraft for the national interest. Working directly with the Department of Defense, Hermeus delivers capabilities that will ensure that our nation, and our allies, maintain an asymmetric advantage over any and all potential adversaries. Hermeus is actively seeking a passionate and talented individual to join our expanding team as a Business Appl…",False,False,"Los Angeles, Los Angeles County",$122k-$122k,121683.53,121683.53,False,False,2025-10-24T12:52:05Z,https://www.adzuna.com/details/5462921047?utm_medium=api&utm_source=4ad8a509,IT Jobs,,500,adzuna,2025-10-24
5462921045,PROCEPT BioRobotics,"Senior Manager, Strategic Sourcing","Job Description Job Description Company Overview Embark on an enriching journey with PROCEPT BioRobotics, where our vision, mission, and values guide everything we do as a company. At PROCEPT, we put the patient first in everything we do and are committed to revolutionizing treatment for benign prostatic hyperplasia (BPH, otherwise known as prostate gland enlargement) through innovation in surgical robotics. As our company succeeds and grows, we improve the quality of life of patients, provide …",False,False,"San Jose, Santa Clara County",$141k-$141k,141469.1,141469.1,False,False,2025-10-24T12:52:05Z,https://www.adzuna.com/details/5462921045?utm_medium=api&utm_source=4ad8a509,Engineering Jobs,,500,adzuna,2025-10-24
5462921052,Crumbl,Instructional Designer,"Job Description Job Description The Instructional Designer reports directly to the Sr. Manager of Instructional Design. Together they create, design and facilitate training for Franchise Partners and managers which best helps improve operational excellence in Crumbl stores. A Crumbl Instructional Designer is responsible for educating, training, and reinforcing Crumbl’s best practices to course participants. Courses may also be facilitated through webinars, digital classes and other live or in-p…",False,False,"Lindon, Utah County",$32k-$32k,31514.95,31514.95,False,False,2025-10-24T12:52:05Z,https://www.adzuna.com/details/5462921052?utm_medium=api&utm_source=4ad8a509,Teaching Jobs,,500,adzuna,2025-10-24
5462921056,INflow Federal,DevOps Engineer \u007C Transitioning Military \uD83C\uDDFA\uD83C\uDDF8,"Job Description Job Description At INflow Federal, we’re not just building infrastructure—we’re shaping the future of national defense. We design and engineer secure, intelligent systems that empower mission success through the seamless integration of human insight and machine capability. With deep roots in Department of Defense (DoD) networks and a commitment to operational excellence, we deliver infrastructure that fuels advanced analytics, AI/ML, and data-driven decision-making at scale. Eve…",False,False,"Saint Louis, Saint Louis County",$116k-$116k,115600.01,115600.01,False,False,2025-10-24T12:52:05Z,https://www.adzuna.com/details/5462921056?utm_medium=api&utm_source=4ad8a509,IT Jobs,,500,adzuna,2025-10-24
